<?xml version="1.0" encoding="UTF-8"?>
<!DOCTYPE liga SYSTEM "liga2.dtd">
<liga>
    <partido goles_local="0" goles_visitante="1">
        <equipo_local>Nottingham Presa</equipo_local>
        <equipo_visitante>Inter de Mitente</equipo_visitante>
    </partido>
    <partido goles_local="3" goles_visitante="3">
        <equipo_local>Vodka Juniors</equipo_local>
        <equipo_visitante>Sparta da Risa</equipo_visitante>
    </partido>
    <partido goles_local="4" goles_visitante="2">
        <equipo_local>Water de Munich</equipo_local>
        <equipo_visitante>Esteaua es del grifo</equipo_visitante>
    </partido>
</liga>
